{
  "$schema": "https://json-schema.org/draft/2020-12/schema",
  "$id": "https://kroika.local/schemas/v1/ai-style-analysis.schema.json",
  "title": "Vendor-neutral AI style analysis v1",
  "type": "object",
  "additionalProperties": false,
  "required": ["schema_version", "status", "garment_category", "source_image_views", "silhouette", "neckline", "sleeves", "bodice", "tailoring", "lower_part", "trousers", "closure", "details", "fabric_hypothesis", "observations", "uncertainties", "targeted_questions", "unsupported_features"],
  "properties": {
    "schema_version": {"$ref": "common.schema.json#/$defs/schema_version"},
    "status": {"type": "string", "enum": ["ok", "needs_confirmation", "insufficient_input"]},
    "garment_category": {"type": "string", "enum": ["dress", "sundress", "skirt", "top", "blouse", "shirt", "vest", "blazer", "jacket", "trousers", "shorts", "jumpsuit", "light_coat", "unknown"]},
    "source_image_views": {"type": "array", "minItems": 1, "uniqueItems": true, "items": {"type": "string", "enum": ["front", "back", "side", "detail", "flat_sketch", "unknown"]}},
    "silhouette": {
      "type": "object", "additionalProperties": false, "required": ["fit", "waist_seam", "symmetry", "confidence"],
      "properties": {
        "fit": {"type": "string", "enum": ["fitted", "semi_fitted", "loose", "unknown"]},
        "waist_seam": {"type": "string", "enum": ["present", "absent", "uncertain"]},
        "symmetry": {"type": "string", "enum": ["symmetric", "asymmetric", "uncertain"]},
        "confidence": {"$ref": "#/$defs/confidence"}
      }
    },
    "neckline": {
      "type": "object", "additionalProperties": false, "required": ["front", "back", "collar", "confidence"],
      "properties": {
        "front": {"type": "string", "enum": ["round", "v", "square", "boat", "sweetheart", "other", "unknown"]},
        "back": {"type": "string", "enum": ["round", "v", "square", "other", "unknown"]},
        "collar": {"type": "string", "enum": ["none", "stand", "shirt", "notched", "other", "unknown"]},
        "confidence": {"$ref": "#/$defs/confidence"}
      }
    },
    "sleeves": {
      "type": "object", "additionalProperties": false, "required": ["present", "length", "type", "cuff", "confidence"],
      "properties": {
        "present": {"type": "boolean"},
        "length": {"type": "string", "enum": ["sleeveless", "cap", "short", "elbow", "three_quarter", "long", "unknown"]},
        "type": {"type": "string", "enum": ["set_in", "raglan", "dolman", "puff", "other", "unknown"]},
        "cuff": {"type": "string", "enum": ["none", "simple", "band", "buttoned", "elastic", "unknown"]},
        "confidence": {"$ref": "#/$defs/confidence"}
      }
    },
    "bodice": {
      "type": "object", "additionalProperties": false, "required": ["visible_darts", "princess_seams", "yoke", "confidence"],
      "properties": {
        "visible_darts": {"type": "array", "uniqueItems": true, "items": {"type": "string", "enum": ["bust", "waist_front", "waist_back", "shoulder", "none", "unknown"]}},
        "princess_seams": {"type": "string", "enum": ["none", "armhole", "shoulder", "unknown"]},
        "yoke": {"type": "string", "enum": ["none", "front", "back", "both", "unknown"]},
        "confidence": {"$ref": "#/$defs/confidence"}
      }
    },
    "tailoring": {
      "type": "object", "additionalProperties": false, "required": ["front_structure", "breasting", "lapel", "collar", "vents", "pockets", "lining", "confidence"],
      "properties": {
        "front_structure": {"type": "string", "enum": ["single_panel", "side_panel", "princess", "unknown"]},
        "breasting": {"type": "string", "enum": ["none", "single_breasted", "double_breasted", "unknown"]},
        "lapel": {"type": "string", "enum": ["none", "notch", "peak", "shawl", "other", "unknown"]},
        "collar": {"type": "string", "enum": ["none", "stand", "shirt", "notched", "shawl", "other", "unknown"]},
        "vents": {"type": "array", "uniqueItems": true, "items": {"type": "string", "minLength": 1, "maxLength": 80}},
        "pockets": {"type": "array", "uniqueItems": true, "items": {"type": "string", "minLength": 1, "maxLength": 80}},
        "lining": {"type": "string", "enum": ["none_visible", "partial", "full", "unknown"]},
        "confidence": {"$ref": "#/$defs/confidence"}
      }
    },
    "lower_part": {
      "type": "object", "additionalProperties": false, "required": ["type", "length_category", "slit", "confidence"],
      "properties": {
        "type": {"type": "string", "enum": ["straight", "pencil", "a_line", "gathered", "pleated", "circle", "tiered", "unknown"]},
        "length_category": {"type": "string", "enum": ["mini", "knee", "midi", "maxi", "unknown"]},
        "slit": {"type": "string", "enum": ["none", "front", "back", "side", "unknown"]},
        "confidence": {"$ref": "#/$defs/confidence"}
      }
    },
    "trousers": {
      "type": "object", "additionalProperties": false, "required": ["rise", "fit", "length", "waistband", "pleats", "confidence"],
      "properties": {
        "rise": {"type": "string", "enum": ["low", "natural", "high", "unknown"]},
        "fit": {"type": "string", "enum": ["slim", "straight", "relaxed", "wide", "unknown"]},
        "length": {"type": "string", "enum": ["short", "cropped", "ankle", "full", "unknown"]},
        "waistband": {"type": "string", "enum": ["none", "straight", "shaped", "elastic", "unknown"]},
        "pleats": {"type": "string", "enum": ["none", "single", "double", "unknown"]},
        "confidence": {"$ref": "#/$defs/confidence"}
      }
    },
    "closure": {
      "type": "object", "additionalProperties": false, "required": ["type", "location", "confidence"],
      "properties": {
        "type": {"type": "string", "enum": ["zipper", "buttons", "hooks", "wrap", "none_visible", "unknown"]},
        "location": {"type": "string", "enum": ["center_front", "center_back", "side", "shoulder", "unknown"]},
        "confidence": {"$ref": "#/$defs/confidence"}
      }
    },
    "details": {
      "type": "object", "additionalProperties": false, "required": ["pockets", "pleats", "gathers", "visible_seams", "lining_visible"],
      "properties": {
        "pockets": {"$ref": "#/$defs/strings"},
        "pleats": {"$ref": "#/$defs/strings"},
        "gathers": {"$ref": "#/$defs/strings"},
        "visible_seams": {"$ref": "#/$defs/strings"},
        "lining_visible": {"type": "string", "enum": ["yes", "no", "unknown"]}
      }
    },
    "fabric_hypothesis": {
      "type": "object", "additionalProperties": false, "required": ["structure", "stretch", "weight", "drape", "must_confirm"],
      "properties": {
        "structure": {"type": "string", "enum": ["woven", "knit", "unknown"]},
        "stretch": {"type": "string", "enum": ["none", "low", "medium", "high", "unknown"]},
        "weight": {"type": "string", "enum": ["light", "medium", "heavy", "unknown"]},
        "drape": {"type": "string", "enum": ["crisp", "medium", "fluid", "unknown"]},
        "must_confirm": {"type": "boolean", "const": true}
      }
    },
    "observations": {"type": "array", "items": {"$ref": "#/$defs/observation"}},
    "uncertainties": {"$ref": "#/$defs/strings"},
    "targeted_questions": {"$ref": "#/$defs/strings"},
    "unsupported_features": {"$ref": "#/$defs/strings"},
    "design_features": {
      "description": "Расширенный визуальный разбор деталей фасона этапа 16. Поле необязательно только для чтения проектов, созданных до этапа 16; новые AI-ответы обязаны его заполнять.",
      "type": "object",
      "additionalProperties": false,
      "required": ["elements", "layers", "proportions"],
      "properties": {
        "elements": {
          "type": "array",
          "maxItems": 24,
          "items": {"$ref": "#/$defs/design_element"}
        },
        "layers": {
          "type": "array",
          "minItems": 1,
          "maxItems": 6,
          "items": {"$ref": "#/$defs/design_layer"}
        },
        "proportions": {
          "type": "object",
          "additionalProperties": false,
          "required": ["waist_position", "volume", "hem_shape", "asymmetry", "confidence"],
          "properties": {
            "waist_position": {"type": "string", "enum": ["low", "natural", "high", "unknown"]},
            "volume": {"type": "string", "enum": ["fitted", "regular", "relaxed", "voluminous", "unknown"]},
            "hem_shape": {"type": "string", "enum": ["straight", "curved", "asymmetric", "tiered", "unknown"]},
            "asymmetry": {"type": "string", "enum": ["yes", "no", "unknown"]},
            "confidence": {"$ref": "#/$defs/confidence"}
          }
        }
      }
    }
  },
  "$defs": {
    "confidence": {"type": "number", "minimum": 0, "maximum": 1},
    "strings": {"type": "array", "uniqueItems": true, "items": {"type": "string", "minLength": 1, "maxLength": 500}},
    "observation": {
      "type": "object", "additionalProperties": false,
      "required": ["feature", "value", "confidence", "evidence"],
      "properties": {
        "feature": {"type": "string", "minLength": 1, "maxLength": 100},
        "value": {"type": "string", "minLength": 1, "maxLength": 200},
        "confidence": {"$ref": "#/$defs/confidence"},
        "evidence": {"type": "string", "minLength": 1, "maxLength": 500}
      }
    },
    "design_element": {
      "type": "object",
      "additionalProperties": false,
      "required": ["element_id", "type", "variant", "description_ru", "location", "construction", "count", "symmetry", "confidence", "evidence_ru", "requires_confirmation"],
      "properties": {
        "element_id": {"type": "string", "pattern": "^[a-z][a-z0-9_-]{1,63}$"},
        "type": {
          "type": "string",
          "enum": ["waistband", "belt", "sash", "pleat", "tuck", "gather", "ruffle", "flounce", "peplum", "yoke", "panel", "overlay", "drape", "pocket", "closure", "slit", "vent", "hood", "collar", "cuff", "strap", "dart", "princess_seam", "decorative_seam", "other"]
        },
        "variant": {"type": "string", "enum": ["standard", "straight", "shaped", "elastic", "tie", "knife", "box", "inverted", "accordion", "soft", "circular", "gathered", "patch", "slash", "welt", "zipper", "buttons", "hooks", "concealed", "single", "double", "shirt", "notched", "shawl", "stand", "other", "unknown"]},
        "description_ru": {"type": "string", "minLength": 1, "maxLength": 240},
        "location": {
          "type": "string",
          "enum": ["bodice_front", "bodice_back", "neckline", "shoulder", "waist", "skirt_front", "skirt_back", "trouser_front", "trouser_back", "sleeve", "hem", "full_garment", "unknown"]
        },
        "construction": {"type": "string", "enum": ["integrated", "separate_piece", "applied", "layered", "unknown"]},
        "count": {"type": ["integer", "null"], "minimum": 1, "maximum": 32},
        "symmetry": {"type": "string", "enum": ["symmetric", "asymmetric", "single", "unknown"]},
        "confidence": {"$ref": "#/$defs/confidence"},
        "evidence_ru": {"type": "string", "minLength": 1, "maxLength": 500},
        "requires_confirmation": {"type": "boolean"}
      }
    },
    "design_layer": {
      "type": "object",
      "additionalProperties": false,
      "required": ["layer_id", "role", "coverage", "material_hint_ru", "opacity", "drape", "confidence", "requires_confirmation"],
      "properties": {
        "layer_id": {"type": "string", "pattern": "^[a-z][a-z0-9_-]{1,63}$"},
        "role": {"type": "string", "enum": ["main", "lining", "interfacing", "overlay"]},
        "coverage": {"type": "string", "enum": ["full", "bodice", "skirt", "sleeves", "detail", "unknown"]},
        "material_hint_ru": {"type": "string", "minLength": 1, "maxLength": 160},
        "opacity": {"type": "string", "enum": ["opaque", "semi_transparent", "transparent", "unknown"]},
        "drape": {"type": "string", "enum": ["crisp", "medium", "fluid", "unknown"]},
        "confidence": {"$ref": "#/$defs/confidence"},
        "requires_confirmation": {"type": "boolean"}
      }
    }
  }
}
