{
  "schema_version": "1.0.0",
  "status": "needs_confirmation",
  "garment_category": "dress",
  "source_image_views": ["front"],
  "silhouette": {"fit": "semi_fitted", "waist_seam": "present", "symmetry": "symmetric", "confidence": 0.91},
  "neckline": {"front": "round", "back": "unknown", "collar": "none", "confidence": 0.94},
  "sleeves": {"present": false, "length": "sleeveless", "type": "unknown", "cuff": "none", "confidence": 0.98},
  "bodice": {"visible_darts": ["bust", "waist_front"], "princess_seams": "none", "yoke": "none", "confidence": 0.78},
  "tailoring": {"front_structure": "single_panel", "breasting": "none", "lapel": "none", "collar": "none", "vents": [], "pockets": [], "lining": "unknown", "confidence": 0.54},
  "lower_part": {"type": "a_line", "length_category": "midi", "slit": "unknown", "confidence": 0.87},
  "trousers": {"rise": "unknown", "fit": "unknown", "length": "unknown", "waistband": "unknown", "pleats": "unknown", "confidence": 0},
  "closure": {"type": "unknown", "location": "unknown", "confidence": 0},
  "details": {"pockets": [], "pleats": [], "gathers": [], "visible_seams": ["waist"], "lining_visible": "unknown"},
  "fabric_hypothesis": {"structure": "woven", "stretch": "unknown", "weight": "medium", "drape": "medium", "must_confirm": true},
  "observations": [
    {"feature": "waist_seam", "value": "present", "confidence": 0.91, "evidence": "На переднем виде заметна горизонтальная линия соединения лифа и юбки."}
  ],
  "uncertainties": ["Не видны конструкция спинки и застёжка."],
  "targeted_questions": ["Какая застёжка предусмотрена на спинке?", "Есть ли сзади талиевые вытачки?"],
  "unsupported_features": []
}
